{
  "format": "code-composer-performance-score/v1",
  "source_song": {
    "format": "code-composer-song/v1",
    "fingerprint": "14bbff217951e202174ebfcf1abaf66f4a0dac760fecaa29705fb66f6c5e3848"
  },
  "meta": {
    "title": "Copper Lines",
    "revision": "cr07-dogfood-r0"
  },
  "tracks": [
    {
      "id": "guitar-chop",
      "events": [
        {
          "id": "g-b1-1-5",
          "type": "note",
          "start_beat": 0,
          "duration_beats": 1.35,
          "midi": 59,
          "velocity": 0.22
        },
        {
          "id": "g-b1-1-8",
          "type": "note",
          "start_beat": 0,
          "duration_beats": 1.35,
          "midi": 64,
          "velocity": 0.18
        },
        {
          "id": "g-b1-1-r",
          "type": "note",
          "start_beat": 0,
          "duration_beats": 1.35,
          "midi": 52,
          "velocity": 0.28
        },
        {
          "id": "g-b1-2-5",
          "type": "note",
          "start_beat": 2,
          "duration_beats": 1.35,
          "midi": 59,
          "velocity": 0.22
        },
        {
          "id": "g-b1-2-8",
          "type": "note",
          "start_beat": 2,
          "duration_beats": 1.35,
          "midi": 64,
          "velocity": 0.18
        },
        {
          "id": "g-b1-2-r",
          "type": "note",
          "start_beat": 2,
          "duration_beats": 1.35,
          "midi": 52,
          "velocity": 0.28
        },
        {
          "id": "g-b2-1-5",
          "type": "note",
          "start_beat": 4,
          "duration_beats": 1.35,
          "midi": 62,
          "velocity": 0.22
        },
        {
          "id": "g-b2-1-8",
          "type": "note",
          "start_beat": 4,
          "duration_beats": 1.35,
          "midi": 67,
          "velocity": 0.18
        },
        {
          "id": "g-b2-1-r",
          "type": "note",
          "start_beat": 4,
          "duration_beats": 1.35,
          "midi": 55,
          "velocity": 0.28
        },
        {
          "id": "g-b2-2-5",
          "type": "note",
          "start_beat": 6,
          "duration_beats": 1.35,
          "midi": 62,
          "velocity": 0.22
        },
        {
          "id": "g-b2-2-8",
          "type": "note",
          "start_beat": 6,
          "duration_beats": 1.35,
          "midi": 67,
          "velocity": 0.18
        },
        {
          "id": "g-b2-2-r",
          "type": "note",
          "start_beat": 6,
          "duration_beats": 1.35,
          "midi": 55,
          "velocity": 0.28
        },
        {
          "id": "g-b3-1-5",
          "type": "note",
          "start_beat": 8,
          "duration_beats": 1.35,
          "midi": 55,
          "velocity": 0.22
        },
        {
          "id": "g-b3-1-8",
          "type": "note",
          "start_beat": 8,
          "duration_beats": 1.35,
          "midi": 60,
          "velocity": 0.18
        },
        {
          "id": "g-b3-1-r",
          "type": "note",
          "start_beat": 8,
          "duration_beats": 1.35,
          "midi": 48,
          "velocity": 0.28
        },
        {
          "id": "g-b3-2-5",
          "type": "note",
          "start_beat": 10,
          "duration_beats": 1.35,
          "midi": 55,
          "velocity": 0.22
        },
        {
          "id": "g-b3-2-8",
          "type": "note",
          "start_beat": 10,
          "duration_beats": 1.35,
          "midi": 60,
          "velocity": 0.18
        },
        {
          "id": "g-b3-2-r",
          "type": "note",
          "start_beat": 10,
          "duration_beats": 1.35,
          "midi": 48,
          "velocity": 0.28
        },
        {
          "id": "g-b4-1-5",
          "type": "note",
          "start_beat": 12,
          "duration_beats": 1.35,
          "midi": 57,
          "velocity": 0.22
        },
        {
          "id": "g-b4-1-8",
          "type": "note",
          "start_beat": 12,
          "duration_beats": 1.35,
          "midi": 62,
          "velocity": 0.18
        },
        {
          "id": "g-b4-1-r",
          "type": "note",
          "start_beat": 12,
          "duration_beats": 1.35,
          "midi": 50,
          "velocity": 0.28
        },
        {
          "id": "g-b4-2-5",
          "type": "note",
          "start_beat": 14,
          "duration_beats": 1.35,
          "midi": 57,
          "velocity": 0.22
        },
        {
          "id": "g-b4-2-8",
          "type": "note",
          "start_beat": 14,
          "duration_beats": 1.35,
          "midi": 62,
          "velocity": 0.18
        },
        {
          "id": "g-b4-2-r",
          "type": "note",
          "start_beat": 14,
          "duration_beats": 1.35,
          "midi": 50,
          "velocity": 0.28
        },
        {
          "id": "g-b5-1-5",
          "type": "note",
          "start_beat": 16,
          "duration_beats": 1.35,
          "midi": 59,
          "velocity": 0.25
        },
        {
          "id": "g-b5-1-8",
          "type": "note",
          "start_beat": 16,
          "duration_beats": 1.35,
          "midi": 64,
          "velocity": 0.19999999999999998
        },
        {
          "id": "g-b5-1-r",
          "type": "note",
          "start_beat": 16,
          "duration_beats": 1.35,
          "midi": 52,
          "velocity": 0.31000000000000005
        },
        {
          "id": "g-b5-2-5",
          "type": "note",
          "start_beat": 18,
          "duration_beats": 1.35,
          "midi": 59,
          "velocity": 0.25
        },
        {
          "id": "g-b5-2-8",
          "type": "note",
          "start_beat": 18,
          "duration_beats": 1.35,
          "midi": 64,
          "velocity": 0.19999999999999998
        },
        {
          "id": "g-b5-2-r",
          "type": "note",
          "start_beat": 18,
          "duration_beats": 1.35,
          "midi": 52,
          "velocity": 0.31000000000000005
        },
        {
          "id": "g-b6-1-5",
          "type": "note",
          "start_beat": 20,
          "duration_beats": 1.35,
          "midi": 62,
          "velocity": 0.25
        },
        {
          "id": "g-b6-1-8",
          "type": "note",
          "start_beat": 20,
          "duration_beats": 1.35,
          "midi": 67,
          "velocity": 0.19999999999999998
        },
        {
          "id": "g-b6-1-r",
          "type": "note",
          "start_beat": 20,
          "duration_beats": 1.35,
          "midi": 55,
          "velocity": 0.31000000000000005
        },
        {
          "id": "g-b6-2-5",
          "type": "note",
          "start_beat": 22,
          "duration_beats": 1.35,
          "midi": 62,
          "velocity": 0.25
        },
        {
          "id": "g-b6-2-8",
          "type": "note",
          "start_beat": 22,
          "duration_beats": 1.35,
          "midi": 67,
          "velocity": 0.19999999999999998
        },
        {
          "id": "g-b6-2-r",
          "type": "note",
          "start_beat": 22,
          "duration_beats": 1.35,
          "midi": 55,
          "velocity": 0.31000000000000005
        },
        {
          "id": "g-b7-1-5",
          "type": "note",
          "start_beat": 24,
          "duration_beats": 1.35,
          "midi": 64,
          "velocity": 0.25
        },
        {
          "id": "g-b7-1-8",
          "type": "note",
          "start_beat": 24,
          "duration_beats": 1.35,
          "midi": 69,
          "velocity": 0.19999999999999998
        },
        {
          "id": "g-b7-1-r",
          "type": "note",
          "start_beat": 24,
          "duration_beats": 1.35,
          "midi": 57,
          "velocity": 0.31000000000000005
        },
        {
          "id": "g-b7-2-5",
          "type": "note",
          "start_beat": 26,
          "duration_beats": 1.35,
          "midi": 64,
          "velocity": 0.25
        },
        {
          "id": "g-b7-2-8",
          "type": "note",
          "start_beat": 26,
          "duration_beats": 1.35,
          "midi": 69,
          "velocity": 0.19999999999999998
        },
        {
          "id": "g-b7-2-r",
          "type": "note",
          "start_beat": 26,
          "duration_beats": 1.35,
          "midi": 57,
          "velocity": 0.31000000000000005
        },
        {
          "id": "g-b8-1-5",
          "type": "note",
          "start_beat": 28,
          "duration_beats": 1.35,
          "midi": 57,
          "velocity": 0.25
        },
        {
          "id": "g-b8-1-8",
          "type": "note",
          "start_beat": 28,
          "duration_beats": 1.35,
          "midi": 62,
          "velocity": 0.19999999999999998
        },
        {
          "id": "g-b8-1-r",
          "type": "note",
          "start_beat": 28,
          "duration_beats": 1.35,
          "midi": 50,
          "velocity": 0.31000000000000005
        },
        {
          "id": "g-b8-2-5",
          "type": "note",
          "start_beat": 30,
          "duration_beats": 1.35,
          "midi": 57,
          "velocity": 0.25
        },
        {
          "id": "g-b8-2-8",
          "type": "note",
          "start_beat": 30,
          "duration_beats": 1.35,
          "midi": 62,
          "velocity": 0.19999999999999998
        },
        {
          "id": "g-b8-2-r",
          "type": "note",
          "start_beat": 30,
          "duration_beats": 1.35,
          "midi": 50,
          "velocity": 0.31000000000000005
        }
      ]
    },
    {
      "id": "bass-run",
      "events": [
        {
          "id": "b-1-1",
          "type": "note",
          "start_beat": 0,
          "duration_beats": 1.75,
          "midi": 40,
          "velocity": 0.48
        },
        {
          "id": "b-1-2",
          "type": "note",
          "start_beat": 2,
          "duration_beats": 1.6,
          "midi": 40,
          "velocity": 0.42
        },
        {
          "id": "b-2-1",
          "type": "note",